{
  "chemicalRef": {
    "casrn": "80-05-7",
    "dtxsid": "DTXSID7020182",
    "preferredName": "Bisphenol A"
  },
  "exposureSignal": {
    "cpdat": {
      "recordCount": 1,
      "selectedMetrics": {
        "name": "DTXSID7020182",
        "productUseCategory": "food-contact"
      },
      "sourceTool": "search_cpdat"
    },
    "httk": {
      "recordCount": 1,
      "selectedMetrics": {
        "fractionUnboundPlasma": 0.07,
        "intrinsicClearance": 1.2,
        "parameter": "CLint",
        "unit": "L/h/kg"
      },
      "sourceTool": "get_exposure_httk"
    },
    "mmdb": {
      "recordCount": 1,
      "selectedMetrics": {
        "endpoint": "plasma_concentration",
        "studyCount": 3
      },
      "sourceTool": "get_exposure_mmdb_aggregate_by_dtxsid"
    },
    "seem": {
      "recordCount": 1,
      "selectedMetrics": {
        "medianExposure": 0.12,
        "unit": "mg/kg-day"
      },
      "sourceTool": "get_seem_general"
    }
  },
  "generatedFromTools": [
    "get_chemical_details",
    "get_bioactivity_aed",
    "get_seem_general",
    "get_exposure_httk",
    "get_exposure_mmdb_aggregate_by_dtxsid",
    "search_cpdat"
  ],
  "hazardSignal": {
    "recordCount": 1,
    "selectedMetric": {
      "aeid": "123",
      "aedType": "administered_equivalent_dose",
      "aedVal": 6.0,
      "aedValUnit": "mg/kg-day",
      "httkModel": "3compartment",
      "httkVersion": "3.0"
    },
    "sourceTool": "get_bioactivity_aed"
  },
  "knownDataGaps": [],
  "limitations": [
    "This tool is intended for screening prioritization, not final risk characterization.",
    "The screening margin uses only the minimum available AED and the maximum available SEEM general exposure estimate.",
    "HTTK, MMDB, and CPDat slices are supporting context and are not folded directly into the margin calculation."
  ],
  "prioritization": {
    "basis": "Calculated as the minimum available AED divided by the maximum available SEEM general exposure estimate when units matched.",
    "caveats": [
      "Screening only; this output is not a regulatory risk determination."
    ],
    "exposureEstimate": 0.12,
    "exposureUnit": "mg/kg-day",
    "hazardPointOfDeparture": 6.0,
    "hazardUnit": "mg/kg-day",
    "marginOfExposure": 50.0,
    "priorityBand": "higher",
    "priorityHeuristic": {
      "higher": "margin < 100",
      "inconclusive": "core inputs missing or incompatible",
      "lower": "margin >= 1000",
      "moderate": "100 <= margin < 1000"
    },
    "signalDirection": "smaller_margin_means_higher_priority",
    "supportingSignals": [
      "CPDat product-use records were present.",
      "MMDB aggregate biomonitoring records were present."
    ]
  },
  "provenanceSummary": {
    "generatedBy": "prioritize_risk_signals",
    "identityMode": "dtxsid",
    "sourceCount": 6,
    "sourceTools": [
      "get_chemical_details",
      "get_bioactivity_aed",
      "get_seem_general",
      "get_exposure_httk",
      "get_exposure_mmdb_aggregate_by_dtxsid",
      "search_cpdat"
    ]
  }
}
